The room is a total mess.,,
This isn't the type that I like.,,
His skin is very white.,,
They're in love.,,
His bicycle is blue.,,
He put forth a condition.,,
He raised a series of questions.,,
We put forth our views one after another.,,
The fruit is very fresh.,,
The fruit in the supermarket is very fresh.,,
Winter in the northeast is too cold.,,
Allen is a poet.,,
I think he is somewhat like a poet.,,
The poet and scholar is dead.,,
These photos are very clear.,,
His pronunciation is clear.,,
His pronunciation is not clear.,,
He's showing a new car to his client.,,
The customers appear to be really angry.,,
The customer(s) appear to be very relaxed.,,
The customers appear to be really happy.,,
"Having finished eating, he got ready to go to work.",,
Xiao Qiang goes to school every day after breakfast.,,
He looks a little silly.,,
She touched his nose.,,
Dogs have very sensitive noses.,,
He feels very lonely.,,
I am very lonely.,,
They spread open the map.,,
Everybody started a discussion about this matter.,,
I accept your challenge.,,
Are you going to the bookstore?,,
The bookstore is not big.,,
The teacher is at the bookstore.,,
Is the bookstore big?,,
The bookstore is very small.,,
"Excuse me, where is the bookstore?",,
Ms. Wang wants to go to the bookstore today.,,
Where is the bookstore?,,
"Excuse me, are you going to the bookstore?",,
My classmate is going to the bookstore.,,
I feel lonely.,,
He feels very very lonely.,,
I lost my luggage.,,
This piece of luggage is too big. It takes up too much room.,,
She's become a nurse.,,
My little sister plans on becoming a nurse.,,
She is a nurse.,,
The nurse will tell you how to do it.,,
He went to some place.,,
I know one of those people.,,
He lives some place around the park.,,
The police suspected him.,,
I am her auntie/nanny.,,
This auntie/nanny is very pretty.,,
He was threatened.,,
We thought his threat was only a joke.,,
They're threatening me.,,
She is very charming.,,
The number he said is very accurate.,,
His judgment was very accurate.,,
This reform made great achievements.,,
Nothing has resulted from his efforts.,,
She is both pretty and has money.,,
Do you have any money?,,
"Though he is rich, he is not happy.",,
He goes to church on Sundays.,,
A phone has been installed in the office.,,
Agriculture is very important.,,
I feel very bored.,,
I've heard that living in Canada is very boring.,,
Is living in Canada boring?,,
He has nothing to do and is very bored.,,
Studying math is very boring.,,
I've heard that this teacher is very boring.,,
His girlfriend is very boring.,,
Is studying English boring?,,
My younger sister is very boring.,,
I've heard that studying English is very boring.,,
He's fallen asleep.,,
She fell asleep leaning on a chair.,,
Watching football games is thrilling.,,
The experimental part is very important.,,
Three months is too short a time to finish the experiment.,,
She's conducting an experiment.,,
They're analyzing the result of the experiment.,,
His analysis is in-depth.,,
I have a strong impression of him.,,
This hole is very deep.,,
He's cutting the fruit.,,
The Culture Revolution occurred in China in 1968.,,
The baby is sleeping.,,
She showed the visitor her baby.,,
That couple lives a happy/blessed life.,,
They married and are husband and wife.,,
The couple are taking a walk in the park.,,
This hotel is very cheap.,,
It's strange that he would say this.,,
Tibet belongs to China.,,
The semester is over.,,
They're eating in a restaurant.,,
He went to the restaurant to eat breakfast.,,
The restaurant is quite nice inside.,,
The atmosphere in this restaurant is quite nice.,,
Someone farted.,,
Do you really need to ask questions to know the answer?,,
The children are constantly asking questions.,,
The scenery here is beautiful.,,
The scenery in this area is very beautiful.,,
"Someday, I'll be able to run fast like the wind.",,
"When work is letting out, there are super many people in the subway.",,
Gold is very expensive.,,
I'm very sad.,,
"Science can accelerate economic development, but it can also bring environmental problems.",,
I live in New York.,,
Nobody knew what the machine was like.,,
Computers are complicated machines. A computer is a complex machine.,,
"Before taking action, we must first make a plan.",,
They've made a new plan.,,
She's drawing a picture.,,
He's appreciating the work.,,
This is an original work I created.,,
They're playing soccer.,,
I gave him a kick.,,
He loves playing soccer.,,
Let's play soccer.,,
The park is very quiet at night.,,
"Well, the night is quite long, isn't it?",,
The experiment achieved a breakthrough.,,
Be-out-of-bed time has arrived.,,
I get up at seven in the morning.,,
Should get out of bed!,,
I have to get up. (formal),,
Have they gotten up?,,
Has he not gotten up yet?,,
The son has to get up at eight.,,
He's my uncle.,,
The man you saw yesterday is my uncle.,,
My uncle gave me a present.,,
My uncle came to see me.,,
My uncle lives near the school.,,
She is now staying at her uncle's house.,,
Did your uncle let you drive his car?,,
Uncle bought a new car.,,
He knows how to earn money.,,
I went strolling down the street and did some shopping today.,,
"She went shopping, leaving her little child all alone.",,
Shopping can satisfy a woman.,,
It's a quarter past nine.,,
It is currently 6:15.,,
He arrived at the company at 8:15.,,
"I wish I could care more about my grades but it maybe seems that, at a certain point of my life, I decided it wouldn't be so important anymore.",,
It really stinks!,,
Thin is the opposite of thick.,,
I'm sad today.,,
She looked sad.,,
Ms. Zhou was very sad yesterday.,,
You appear to be really sad.,,
Mr. Zheng was very sad yesterday.,,
Ms. Zhou appears to be really sad.,,
The news made her sad.,,
Don't be too sad!,,
There are many flowers planted in the yard.,,
I planted a tree in my yard.,,
I heard the song sung in French.,,
He could not speak French well.,,
It's not easy to master French at all.,,
It's quite difficult to master French in 2 or 3 years.,,
I am very interested in this.,,
What subject do you think he is interested in?,,
The mom is developing her child's interest in music.,,
I have confidence I can succeed.,,
He lacks confidence.,,
The Chinese New Year is drawing near.,,
I was very amazed to hear the news.,,
"Seeing that you're definitely not amazed, I think you must have known.",,
Foreigners amaze me.,,
What does this English sentence mean?,,
How should one translate this sentence?,,
Vocabulary learning is the foundation for sentence learning.,,
"It's too hot, and they have been sweating a lot.",,
"Commissioner, it wasn't me!",,
There are many trees alongside the road.,,
Her car is parked by the road.,,
There's a tree by the road.,,
Please don't waste resources.,,
You should not waste your time.,,
Trying to do such a thing is a waste of time.,,
Don't waste your food.,,
The floor was wiped clean!,,
The child has gone to sleep.,,
This month's income is not bad.,,
"Every month, he has a stable income.",,
His income was high this month.,,
My income increased twofold.,,
The average income of people has increased.,,
The people demanded political liberalization.,,
"Within the area of economic liberalization, our country has already made some achievements.",,
He's carrying a weapon.,,
Open the door and take a look.,,
This company manufactures cars.,,
She's taking a bus.,,
It's very convenient to have a car.,,
There are too many cars on the highway.,,
It's a ten-volume book.,,
Our country has joined the WTO.,,
He's gone mad.,,
He has graduated with a master's degree.,,
He is a scholar of history.,,
"Through hard work, he got a masters degree.",,
Beijing is China's capital.,,
I hope everyone can take part in this activity.,,
3 cubed is 27. 3 to the third power is 27.,,
They're discussing the new job.,,
I got a loan from the bank.,,
I got a loan from the bank and bought a house.,,
Do you hear?,,
He made a lot of money.,,
She's reading a book in a book shop.,,
She's reading with her youngest aunt.,,
He's interested in photography.,,
She's very interested in photography.,,
The factory makes products.,,
This factory lacks technicians.,,
"Not long ago, he lived very far from the factory.",,
The dormitory is next to the factory.,,
This factory's equipment in very new.,,
He owns a factory.,,
This is a very large factory.,,
Factories manufacture products.,,
This factory developed a lot of new products.,,
My boyfriend and I go traveling together.,,
Her boyfriend prefers to live in Canada.,,
She is with her boyfriend.,,
Her boyfriend gave her these flowers.,,
Her boyfriend is very boring.,,
"No, that's not my new boyfriend.",,
Her boyfriend is rich.,,
She's broken up with her boyfriend.,,
That newspaper announces the government's policies on behalf of the government.,,
The masses demand that the government reform.,,
The government has adjusted its policy.,,
The government launched an economic reform policy.,,
This restaurant is launching a new dish.,,
What role does the government play?,,
The government fought against crime.,,
Government officials are subject to the supervision of the people.,,
She is the heroine in this drama.,,
He's a car thief.,,
This man is really cunning.,,
She'd like to smash her computer.,,
She's sitting beside the window.,,
Can you open the window?,,
There are a few households here.,,
Snow is very white.,,
"Here, snow is everywhere.",,
He is removing the snow.,,
It's snowing.,,
My dad has been dead for ten years.,,
He stepped on his dad's foot.,,
You lose.,,
His speech is very clear.,,
Riding a motorbike is very dangerous.,,
The son smugly threatens his mom.,,
I love rice.,,
I am eating rice.,,
Being poor embarrasses me.,,
She became embarrassed and didn't know what to say.,,
I felt very awkward.,,
The leader is willing to accept people's opinions.,,
He is the leader of the company.,,
It looks like an egg.,,
My son is playing by himself.,,
He is a good soldier.,,
The soldiers are on a mission/task.,,
He disclosed my secret.,,
This apple is very big.,,
He bought some apples.,,
The apple is rotting.,,
Apples are a healthy food item.,,
I want to eat apple pie.,,
There is an apple on the table.,,
I've bought a few apples.,,
I've got three apples.,,
She's eating an apple.,,
The kitten is injured.,,
Her foot has been injured.,,
I've injured my leg.,,
You may injure yourself if you don't follow safety procedures.,,
"You may be right, but I am against your ideas.",,
The dragon is a representation of China.,,
Children are their mom's treasures.,,
I'm helping my mom move things. (heavy things),,
He secretly hid.,,
I've been to Beijing.,,
I've been to Germany.,,
Ms. Zhou has not been to France.,,
I've been to Russia before.,,
I have been to the United States.,,
Have you been to the United States?,,
I haven't been to Beijing.,,
I haven't been to China.,,
Has your boss been to China?,,
I have been to Shanghai.,,
Have you been to Shanghai?,,
Have you been to Beijing?,,
Why haven't you been to Shanghai?,,
I haven't been to the United States.,,
Have you been to China?,,
Ms. Wang has been to the United States.,,
She has been to Paris.,,
We have finally arrived in Paris.,,
My keys have disappeared.,,
I found the key for which I had been looking.,,
Donna was born with a silver spoon in her mouth.,,
You can only buy things with cash here.,,
This city is very famous.,,
This company has 200 employees.,,
Losing the ball game depressed him.,,
He looks a bit depressed.,,
Ms. Zhou plans on going to Australia.,,
He was brought up in Australia.,,
I like spaghetti.,,
Doing it this way has a lot of significance.,,
Life without love is just totally pointless.,,
What he says makes no sense at all.,,
He's been to London one time.,,
Are you really going to London to study? It is true that you are going to study in London?,,
"When I am in London, I will most probably go catch a few performances. As long as I'm going to be in London, I ought to see a play or two.",,
London is in the UK.,,
I'd like to go to London. I'd like to visit London.,,
There are a lot of parks in London.,,
There are many beautiful parks in London.,,
When did you get to London?,,
London is the capital of the UK.,,
"As soon as I get to London, I'll drop you a line.",,
Be sure to drop us a line as soon as you get to London.,,
I want to rent an apartment.,,
We live in our school's apartment for students.,,
Her apartment is very very clean.,,
She is looking for an apartment.,,
The apartment has been given a thorough cleaning.,,
"Do you like your apartment? It's alright, but there isn't enough space.",,
The news confirmed my suspicions.,,
Many a young girl likes the singer.,,
"I like that singer's voice, too.",,
"He is not singer, but an actor.",,
This singer is publicizing his new album.,,
Please sign your name!,,
Children trust their parents very much.,,
My son can walk!,,
"Without a car, he can only walk.",,
I've reached retirement age.,,
His income was diminished by half after retirement.,,
"Since it's very late and her daughter has not yet returned home, mom is very worried.",,
I suddenly changed my mind.,,
They live a very orderly life.,,
"In China, doctors are also called ""daifu"".",,
There is a river next to this building.,,
He parked his car in front of the (big) building.,,
Which country's currency is this?,,
There are five people here in total.,,
How many countries are there in Asia altogether?,,
Science&technology can promote economical development.,,
The official language of China is Chinese.,,
This is official news.,,
How much does one fish cost?,,
The little dog is shaking its head and wagging its tail at me.,,
It was a gruelling race.,,
Both sides competed fiercely in the game.,,
There is fierce competition between those two computer companies.,,
There's still ten miles until the next exit.,,
There's a rotten apple on the ground.,,
The machine is running stably.,,
Children should drink milk every day.,,
Ms. Zhou comes from north China.,,
The common people in China are all kind-hearted.,,
Here's the change.,,
There's a well here.,,
They are peace-loving people. They are a peace-loving people.,,
"Wow, how horrible!",,
My shoulder hurts a bit.,,
"When you're young, reading many good books is a good thing.",,
He has a lot of books on history. He has many history books.,,
There are all types of books in the library.,,
This government official is very corrupt.,,
I need it as quickly as possible. I need it ASAP.,,
Please revise this as soon as possible.,,
"When work is stressful, you need to relax a bit.",,
Some people relax through reading.,,
She's writing to her friends.,,
Please write to tell me your situation at school.,,
Father is busy now writing letters.,,
He made a good speech.,,
I arrived too late to hear his speech.,,
I've never (not even one time) made a speech without being nervous.,,
This candy box is empty.,,
He's dialing a telephone number.,,
The government has allocated money to build a school.,,
Many people pursue money.,,
These two doors are very similar.,,
He's under a lot of pressure at work.,,
"Miss, can I please ask how to get to the railway station?",,
Where did you go? I went to the train station to see off my friend.,,
Why is she going to the train station?,,
It will only take me 20 minutes to get to the station by taxi.,,
Tax must be paid on every month's income.,,
One needs to pay taxes as long as one earns income.,,
How many tons does this elephant weigh?,,
"Currently, cross strait relations are not as tense as before.",,
"The two Germanys have reunified, but the two sides across the strait have not.",,
Will the mainland and Taiwan be reunified?,,
There is a lack of communication across the strait.,,
America pays attention to the development of cross-strait relations.,,
What will happen if cross-strait relations continue to worsen?,,
The U.S. constantly tries to avoid problems across the strait.,,
Both sides should avoid war.,,
One million people lost their live during the war.,,
We are against war.,,
No means opposition.,,
The Japanese people have renounced war.,,
The war has stopped.,,
The two sides across the strait should maintain peace.,,
To finish it in one day is practically impossible.,,
The egg broke.,,
"Every morning, he only eats one egg for breakfast.",,
What are your strong points?,,
"Where are the eggs, please?",,
Tom hid under the table.,,
I have gained one kilogram.,,
I promise I won't get drunk tonight.,,
It's convenient for me to see you at ten tonight.,,
What do you say to dining out tonight?,,
We take great pleasure in meeting all of you this evening.,,
She's wiping her tears.,,
Would you take a picture of us with this camera?,,
The bread is half-eaten.,,
He is manufacturing bread.,,
Her balance is very good.,,
It is hard to balance economic development and environmental protection.,,
Why couldn't you sleep last night?,,
My bike was stolen last night. I had my bicycle stolen last night.,,
Yesterday evening we heard the President talk on television.,,
Reporters dig for news.,,
Kids are curious about many things.,,
I'm very curious about this matter.,,
I am curious.,,
Any student of this school must learn one more foreign language besides English.,,
His spoken English has not shown much improvement.,,
I want to sign up for a Chinese course. Really? I think it's too difficult for foreigners to learn Chinese.,,
He clearly could not have climbed over such a high wall.,,
"Up to now, I haven't been to Beijing.",,
"Our task has been effortless so far, but it will be difficult from now on.",,
Wait here till he comes back.,,
The water here is shallow.,,
An army serves its country.,,
She is lucky today.,,
I envy her very much.,,
She is very envious of their relationship.,,
What religion do they believe in?,,
He wants to recruit some new employees.,,
"Newspapers, magazines, and newscasts tell what is going on in the world.",,
He told me the story of his life.,,
The little children gathered round to plant the tree.,,
What's that small child doing?,,
He's the king.,,
You're really an angel!,,
Do you have any relatives in the mainland?,,
All his relatives are in America.,,
"The meat wasn't stored well, and it smells bad.",,
How soon do you need it?,,
How long can I borrow this book?,,
How long does it take to walk to the train station?,,
You're about to stay how long?,,
How long do you plan to stay in this country?,,
How long does it take to get to the train station? How long does it take to get to the station?,,
I wonder how long this is going to take.,,
The lake is deepest at this point.,,
There‘s the carcass of an animal here.,,
The logic of his speech is clear.,,
The water is flowing down.,,
The rain began to fall.,,
It's raining outside.,,
I reckon it will rain tonight.,,
It seems that it's going to rain!,,
"If it rains, we won't travel tomorrow.",,
It often rains here.,,
It looks like it will rain.,,
"With the rain, the weather is more cold.",,
I said it could possibly rain.,,
"If it rains tomorrow, I'll just stay at home.",,
I think it's going to rain.,,
Will it rain tomorrow?,,
"What ghastly weather, it's raining again!",,
It's still raining even now.,,
This is considered to be a big issue.,,
"Hey, come look at this.",,
The living room is very clean.,,
Everyone is participating actively in the discussion.,,
He is the general manager at the company.,,
We're in a meeting right now.,,
The old man attempted to swim five kilometers.,,
"The last three weeks, Jim has been continuously attempting to take me out to dinner.",,
These are his great-grandchildren.,,
Sun Peng wants to become a policeman.,,
Ms. Sun often goes out with friends to have a good time.,,
Autumn is here.,,
"Which do you like better, spring or autumn?",,
It is humid.,,
Wet is the opposite of dry.,,
He's completely wet.,,
He is very cordial.,,
She is no less kind than her sister is.,,
They're giving the dog a bath.,,
I usually take a shower in the evening.,,
The phone rang while I was taking a shower.,,
He wrote this down in his notebook.,,
My little brother passed his university entrance exam last week.,,
He owes a lot of money.,,
I owe ten dollars to her.,,
This brand's quality is good.,,
The boss believes he is very stupid.,,
The boss is really stupid.,,
Her boyfriend is really stupid.,,
She is very stupid.,,
I've heard that manager Lin is really stupid.,,
It's really good to (initiate this task) ourselves.,,
My new apartment is on the 13th floor.,,
Put on your shoes. Let's go out for dinner.,,
She's very patient with children.,,
These shoes are quite durable.,,
A teacher should be patient.,,
Don't be worried. These things take time.,,
He's waiting patiently.,,
His parents are proud of his success.,,
I am proud of my students' progress.,,
She's pointing at the scene in the distance.,,
The children are playing with their toys.,,
The kids are playing with children's toys.,,
The price of this toy is very high.,,
This factory specializes in manufacturing toys.,,
"If any issue, please drop me a line.",,
Sorry but I suddenly have a matter (to attend).,,
Did you find me about something?,,
Today's catch is pretty good.,,
What have you learned after being in Taiwan for 10 months?,,
"Going through several days of training, his gains were very big.",,
The corridor is empty.,,
He married her.,,
A man who can marry a good wife is happy/blessed.,,
He married a rich wife.,,
He married an English girl.,,
Chinese New Years is a traditional Chinese holiday.,,
My friends and I are going shopping at the shopping plaza.,,
He bumped into his classmate at the market.,,
Today's breakfast is toast.,,
I had a cup of tea to keep myself awake.,,
The patient hasn't regained consciousness yet.,,
I've booked a plane ticket on the internet.,,
I ordered several books from England.,,
Someone stole his stapler.,,
She is the manager's secretary.,,
Please inform my secretary first.,,
She is a clerk in the supermarket.,,
The tree bent under the weight of the snow.,,
They are hesitating about which shoes to buy.,,
He looks unhappy.,,
I've earned money from my stocks.,,
You take a risk when you buy stock.,,
Who will provide capital for the venture?,,
He's looking through the name list.,,
We don't know the election results yet.,,
We met her by accident.,,
That matter shocked me.,,
I was shocked at the news.,,
He brought me a Chinese knot from China.,,
These trousers are too tight.,,
"When I was little, I would only wear pants.",,
He has his hand in his pocket.,,
He drew a gun from his pocket.,,
This is an urgent matter.,,
"The situation is urgent, so we must make a decision immediately.",,
I can't stand it anymore!,,
She maybe seems prettier than ever.,,
He promised that what he said above is true.,,
He promised to complete the task in three days.,,
This is my promise.,,
"By the way, have you seen him lately?",,
The problem is yet to be solved.,,
"In 1776, America became independent.",,
Ms. Zhou doesn't teach biology.,,
I don't teach biology.,,
The mouse is stealing the bread.,,
The cat caught the rats.,,
I'm afraid there's no way you can marry her.,,
This museum opens every day.,,
Do you want to go to the museum with me? Not possible. I am very busy.,,
You have to get on that bus to go to the museum.,,
The items in the museum are very attractive.,,
Knowledge is accumulated by reading.,,
This little girl is very smart.,,
The little girl is very happy at this time.,,
The little girl harbors very happy wishes.,,
I hope my dream will come true.,,
The little girl gets on the bus first.,,
Don't be too sensitive to criticism.,,
She's filling in the answers on the exam.,,
There is too much salt in this dish.,,
Eating too much salt is not good for health.,,
The water is boiling.,,
We sincerely hope the two countries communicate and cooperate.,,
Her treatement of the guests is very friendly.,,
The students of this school are kind.,,
She feels very troubled.,,
I am afraid of snakes.,,
She admires/envies her good friend's happy/blessed marriage.,,
Let me introduce my good friend.,,
There will sometimes be contradictions even between good friends.,,
There is contradiction between his wording.,,
She treats me as her good friend.,,
I can speak neither French nor German.,,
Please pass me that document.,,
Turn right at the next intersection.,,
I love eating fried chicken.,,
These pants are very dirty.,,
His face is dirty.,,
I use a credit card to purchase things.,,
You can buy things by credit card.,,
He painted his bicycle red.,,
Altogether there are four people in his family.,,
"He always thinks of others first, and only then thinks of himself.",,
We are not short of oil in this country.,,
The price of oil is increasingly expensive.,,
How much does one liter of oil cost?,,
I have two tickets.,,
"The show was wonderful, but the tickets were too expensive.",,
"If I had one million yen now, I would buy a car.",,
The plan was realized step by step.,,
I realized my goal step by step.,,
The house was built step by step.,,
Why does Ms. Zhu study English?,,
Ms. Zhu doesn't have class on Tuesday.,,
Ms. Zhu lost her key.,,
Ms. Zhu's pronunciation is extremely good.,,
Ms. Zhu taught a Chinese class.,,
Who is Ms. Zhu?,,
Last weekend Ms. Zhu was very busy.,,
Why did Ms. Zhu do that?,,
Freedom is not free.,,
He did it at the expense of his health.,,
This batch of products has been packed.,,
I raise objections to his view.,,
The people protested.,,
The people conducted aggressive demonstrations.,,
