原文, 訳文, 解説, 音声
こんにちは,こんにちわ,,8
こんばんは,こんばんわ,
もしもし,もしもし,
何と言っていますか？,なんつってるん？,
彼らは何について話していますか？,あいつらなにはなしてるん？,
何をしていましたか？,なにしてたん？,
You've done it right.,,
かれらはやりかたをしっています,あいつらやりかたしってるで,
わたしはやりかたをしっています,やりかたしってるで,
私に会えなくてさみしいですか？,おれにあいてん？,
なにがほしいですか？,なにほしん？,
それのやりかたをしっていますか？,やりかたしってるかい？,
あなたの仕事はなんですか？,あんたしごとなにしてるん？,
彼女の仕事はなんですか？,あいつしごとなんなん？,
どこで働いていますか？,どこでつとめてるん？,
どこへいくところですか？,どこいくん？,
どこへいきたいですか？,どこいきてん=？,
どこから来ましたか？,どっからきたん？,
彼女はどこから来ましたか？,あいつどっからきたん？,
どこへ食事をとりに行きたいですか？,めしどこでたべてん=？,
食事がとりたいです,めしたべてん,
彼女は食事がとりたいですか？,あいつめしたべてん=？,
どうされましたか？,どしたん？,
彼の話を聞きましょう。,あいつのはなしききな,
私の話を聞いていますか？,はなしきいてるかい？,
最近どう？,さいきんどうなん？,
最近どう？,さいきんどうなん？,
具合はどうです？,ぐあいどうだい？,
あなたの働きは問題ないと思います。,ちゃんとつとまってるとおもうで,
見てみたいです。,みてみてん,
みさせてください,ちょっとみして,
彼にはできません。,あいつにゃできねん,
生徒たちは私のいうことを聞きません,せいとたちゃおれのはなしきかねん,
あなたのことを愛しています,おまえがすきなん,
彼は自分の仕事が好きではありません。,あいつぁじぶんのしごとすきじゃねんさ,
自分の仕事が好きですか？,じぶんのしごとすきかい？,
千葉が好きです,ちばすきなん,
滋賀は大きいですか？,しがっておおきん？,
滋賀はとても大きいです。,しがわえーれえおおきいで,
He's an American,,
I am an American.,,
彼はアメリカが大好きです。,あいつぁアメリカのことだいすきなん,
Is the United States big?,,
彼はどちらさまですか？,あのひただれなん？,
あなたの生徒は誰ですか,だれがあんたのせーとなん？,
東京へはどう行きますか？,とーきょーわどーいきゃいん？,
彼女は東京へ行く予定です。,あいつぁとーきょーいくん,
Are you Chinese?,,
I'm going to Beijing.,,
東京へ行きたいですか？,とーきょーいきてん？,
これが東京です。,これがとーきょーなん,
ここはどこですか？,ここどこなん？,
これが我が家です,これおれんちなん,
Where is he from?,,
Beijing is a big place.,,
I'm from America.,,
誰が来たのでしょう？,だれきたんかな,
いつ栃木に来ますか？,とちぎいつくるん？,
その生徒は来なかった,あのせーときなかったん,
今日は何をしますか？,きょーなにするん？,
I am wondering if you will come today.,,
彼は今日何をしたいのですか？,あいつぁきょーなにしてん,
わかりましたか？,わかったかい？,
わかりました,わかった,
I heard and understood.,,
彼は友達です。,あいつぁともだちなん,
私はあなたの友達がとても好きです。,おれおまえのともだちだいすきなん,
My friend did not come.,,
Do you like my friend?,,
What would your friend like to do?,,
They are all my friends.,,
We're friends.,,
彼の言っていることがわかりません。,あいつなんつってるかわっかんねん,
When can you tell me?,,
Can you tell me what this is?,,
This is my book.,,
He likes this book.,,
この本が好きではありません。,このほんすきじゃねん,
Which book is your book?,,
That book is mine.,,
その本は誰でもいいからほしい人にあげてください。,そのほんだれでもほしんにくれてやんな,
行きましょう,いくんべ,
"Go when you want, ok?",,
Do whatever he tells you.,,
Would you like to eat with me?,,
I gave you a book.,,
I work with him.,,
I also want to. Then go with us!,,
"Let me think (literally ""let me think one think"")",,
Please let me through / pardon me,,
Please come with me.,,
加藤さん、座ってください,かとーさんすわんな,
Do you like school?,,
I am at school.,,
The students don't like school.,,
I'm going to school.,,
Where is the school?,,
This school is very big.,,
私は教師です,せんせやってるん,
彼女が我々の先生です。,あのひとがおれらのせんせえなん,
They are all good teachers.,,
Are you going to go see the teacher?,,
彼は先生に会いにいきます,あいつせんせーにあいいくん,
The teacher is going to school.,,
Where is the teacher going?,,
Listen to the teacher.,,
The teacher is Chinese.,,
先生の言っていることがわかりません,せんせーのいってるんがわっかんねん,
彼女は先生になりたいです,あいつぁせんせえになり'てん,
勉強していますか？,べんきょしてるかい？,
私がいつ「はい」といえばいいのか彼は教えてくれました。,いつ「はい」っていやいんかあいつがおしえてくれたん,
なんで,なんで,
なんで彼らは行ったのですか？,なんであいつらいったん？,
なんで彼女は行ったのですか？,なんであいついったん？,
Why did you do like that?,,
一人一人が一文ずつ読み上げます。,ひとりいちぶんでよんでくん,ひとりいちぶんでよんでくん
I'd like to say a few words to you.,,
Today is Monday.,,
何曜日ですか？,なんようなん？,
ここにはもう2週間います,ここはもう２しゅうかんいるん,
Today is Tuesday.,,
Today is Saturday.,,
Today is Sunday.,,
何かした方がよいことはありますか？,なんかしたほうがいいかい？,
6時です,６じだで,
What time is it now?,,
It's ten o'clock now.,,
6時40分です,ろくじ　'よんじゅっぷんだで,
Are you a bit better now?,,
It is already eleven.,,
She has a lot to do.,,
There is a lot of money here.,,
今どうなっていますか？,いまどうなってるん？,
It's already five o'clock.,,
(Right now) It's five.,,
(Right now) It's half past three.,,
(Right now) It's three.,,
(Right now) It's five forty.,,
It's nine o'clock now.,,
(Right now) It's nine thirty.,,
(Right now) It's half past four.,,
I'll tell you something.,,
今日はだいぶ気分がいいです。,きょーわだいぶよくなったみて,
気分はどうですかと彼は尋ねました,ぐあいどうだいってあいつがきいてき'たん,
仕事は好きですか？ええ、本当に面白くて。,しごとすきかい？うん、まーずおもしろいん,
今日は何日ですか？,きょーいくんち？,
What month is next month?,,
今日はとても天気が良いです。,きょーわまーずてんきがいんね,
The weather is just so nice.,,
今日は忙しいですか？,きょーいそがしん？,
今週はとても忙しいです。,こんしゅーわん－といそがしん,
Who is Mr. Zheng?,,
なぜ張さんはそのようなことをしたのですか？,なんでちょーさんそんなことしたん？,
I worked continuously this week.,,
あなたの言っていることは正しいと思います。,あんたがいってるこたほんとだとおもうん,
あなたの言っていることは正しいと思います。,あんたがいってるこたほんとだとおもうん,
Where does your friend live?,,
I don't understand Chinese.,,
I do not know how to write Chinese.,,
She teaches Chinese.,,
I teach Chinese.,,
My friend teaches Chinese.,,
Of course it's okay.,,
Do you know Chinese characters? I don't know them.,,
なにをしていますか？,なにしてるん？,
He doesn't like his classmates.,,
We're classmates.,,
My classmate doesn't have any money.,,
とうとう彼女はこなかった,とー'とーあいつこなかったん,
"Excuse me, do you have a cell phone?",,
Do you have a cell phone?,,
Where is your cell phone?,,
This is a cell phone.,,
Where is the cell phone?,,
I have a cell phone.,,
"Excuse me, where is the school?",,
携帯はどこで買えますか？,けーたいってどこでかえるん,
それは買えません,それかえねん,
どっちでも好きな方を買っていいですが、両方はだめです。,どっちでもすきなんかっていいけど、かたほうにしな,
帰宅しました,いえけーってきたん,
彼は何時に帰って来ますか？,あいつぁなんじにかえるん,
Can I go home?,,
She can return home.,,
What time are you going home?,,
I want to say a few words.,,
Is your university big?,,
When will he go to university?,,
今日はとてもお金を使いました,きょーん－とおかねつかちゃったん,
My mom is very busy.,,
Who is it? It's your mom.,,
戻りました。,けーってきたで,
彼女が帰ってくるのを待って質問してください,あいつがけーってくるんまってききな,
中国語を勉強することはとても面白いです。,ちゅうごくごべんきょうするんん－とたのしん,
"Is it interesting? No, it's not interesting.",,
He came to China to learn Chinese.,,
I want to know what this phrase/sentence means.,,
How do you study Chinese?,,
Will she study Chinese?,,
Where can I study Chinese?,,
I will study Chinese.,,
How much does this piece of clothing cost?,,
Maria spends a lot of money on clothes.,,
I like buying clothes.,,
She bought a piece of clothing.,,
How is his Chinese?,,
My work is interesting.,,
Your friend is very interesting.,,
She would prefer to study Chinese at a university.,,
I just want to know what time you'll come back.,,
Chinese culture is very interesting.,,
American culture is very interesting.,,
They have their own culture.,,
I live on the second floor.,,
Mom has gone to the market. (open-air market),,
He speaks English really well.,,
Do you know how to speak English?,,
You speak English very well.,,
From now on I will speak English.,,
The students would like to study English.,,
How is her English?,,
Why don't you like to study English?,,
Where can I buy English-language books?,,
Is studying English interesting?,,
Where can I study English?,,
Speaking Chinese is very difficult.,,
How do you study English?,,
Writing English is not difficult.,,
Speaking English is not difficult.,,
Learning Chinese is difficult.,,
Is it difficult to speak Chinese?,,
Is your work difficult?,,
My work is not difficult.,,
English is difficult to learn.,,
His work is not difficult.,,
"Excuse me, where can I buy English-language books?",,
I have been studying English for four years.,,
Say it in English.,,
Everyone knows she can speak English well.,,
She feels very tired.,,
"You are tired, aren't you?",,
I am at home.,,
I am already very tired.,,
Is she very tired today?,,
Is she at home?,,
Work was especially tiring today.,,
This is your computer.,,
Whose computer is this?,,
What do you think?,,
Does Shanghai have a lot of people?,,
Shanghai has a lot of people.,,
"Please use as you wish, don't be polite.",,
Why will she go back to Shanghai today?,,
I'm not going to Shanghai.,,
What happened?,,
I wonder what has happened to her.,,
I am going to see a movie.,,
I want to go see a movie.,,
What movies are released this week?,,
I have been waiting for a friend of mine for an hour.,,
He and I are the same age.,,
Sam is two years younger than Tom.,,
One of them is doing and the other is watching.,,
What have you seen?,,
Are you ready?,,
"I'm headed to school. (literally ""toward school going"")",,
I'm reading an English book.,,
I teach English at a university.,,
The teacher teaches English to us.,,
Do you teach English?,,
This is my father.,,
What are they discussing?,,
They're reading a book.,,
Thank you for your help.,,
I have no friends to help me.,,
Help me for a moment,,
I'll come help you.,,
Thank you!,,
I have a lot of friends to help me.,,
I help him study Chinese.,,
I find this book is very difficult to read.,,
She needs help.,,
Do you need my help? (help your busyness),,
They're taking an exam.,,
Let me try.,,
I understand her.,,
I love my mother.,,
He gets up late every day.,,
He goes to school to study every day.,,
What do you want to drink?,,
I've got one hundred RMB.,,
Would you like something to drink?,,
I would like to drink something.,,
She would like to drink a little something.,,
I would like to eat a little something.,,
My students learn things quickly.,,
Mr. Zheng learns things quickly.,,
I am listening to you.,,
What are they doing?,,
He casually ate a few bites and just left.,,
Please keep speaking.,,
"Let us keep working, ok?",,
Please continue speaking.,,
Carry on!,,
Her mother will continue to work.,,
Does everyone view my decision as correct?,,
I'm a man.,,
A man should work.,,
"By now, he should have already arrived.",,
He should arrive around now.,,
Is your school in this city?,,
Take it / hold it,,
Everyone is standing.,,
She once tried to teach me Chinese.,,
I can only wait.,,
I can't let myself do this kind of thing.,,
I'm as tired as can be.,,
When will you return to your country? Next month.,,
Something might have happened to her.,,
I didn't know about this matter.,,
How can you not know?,,
I don't know if I still have it.,,
Do you know him?,,
I have known her for two years.,,
"Oh, I know this man!",,
"Is he an American? No, he's not. He's German.",,
I know all of them. (people),,
I know him.,,
How do you know him?,,
Do you know his teacher?,,
He knows a lot of people.,,
Do you know my student?,,
"Today, I made a new friend.",,
She doesn't know how to choose.,,
Do I have any other options?,,
Who is she speaking with?,,
Who is he speaking with?,,
We like his way of talking very much.,,
Give me a phone call.,,
Please give me a phone call.,,
I should give her a phone call.,,
She doesn't like the way I speak.,,
Can I give him a phone call?,,
Please give him a phone call.,,
Can I give you a phone call?,,
In what way shall I tell him (about that)?,,
Is the hotel big?,,
Where is the hotel located?,,
She would like to go to the hotel.,,
An opportunity came.,,
They are chatting.,,
Everybody's welcome to come China to learn Chinese.,,
Welcome back home.,,
I'm going to the restaurant.,,
"Nevermind (literally ""no relation"")",,
Where is the restaurant?,,
Are you going to the restaurant?,,
He is very smart.,,
I am not as smart as he.,,
I'm really not smart.,,
Do you have a computer? I have one at the office.,,
He's my son.,,
My son is three years old.,,
Your son is very smart.,,
This is my son.,,
He left home and went to school.,,
My home is very close to the school.,,
He has just left home.,,
He's just left the company.,,
I want to see this movie.,,
Please give me a glass of water.,,
Let me introduce my classmate.,,
I'll also introduce myself!,,
Please introduce yourself.,,
My dad is busy.,,
My dad is much taller than me.,,
Your dad is tall.,,
You're one meter tall.,,
Thanks for your answer.,,
What did you answer?,,
"""You are too great!"" Willie answered.",,
She had just arrived home when I called.,,
He just returned home.,,
Do you like music? Do you love music?,,
"""She likes music."" ""So do I.""",,
Let me know if there is anything I can do.,,
Nobody believes what I say.,,
You can take your time.,,
They walk very slowly.,,
Tom speaks more slowly than Bill.,,
"""Believe me"", he said.",,
This is your letter.,,
Take your time.,,
You need to believe in your own ability.,,
He is out now.,,
"Dad is out, but mom is at home.",,
Did anyone call me while I was out?,,
What study method do you use?,,
Did you understand?,,
Did you guys understand what I mean?,,
I'll tell you guys a story.,,
"At last, I understand.",,
May I ask a few questions?,,
This (exam or homework problem) is very difficult.,,
"Everyone, please do some research on this problem.",,
He runs really fast.,,
He ran as fast as he could.,,
Bill can run faster than Bob.,,
I've run three miles.,,
She ran one section of road.,,
The weather is extremely great today.,,
I know Ms. Wang.,,
I work with Ms. Wang.,,
Ms. Zhou is going to see a movie.,,
How do you know Ms. Zhou?,,
Ms. Wang teaches Chinese at a university.,,
I'll give Ms. Zhou a phone call.,,
Where does Ms. Zhou work?,,
Ms. Zhou is at home now.,,
"Excuse me, where is Ms. Zhou?",,
Ms. Wang is not at the hotel.,,
Where is Ms. Wang?,,
What time is Ms. Wang going home?,,
How is Ms. Wang's English?,,
Ms. Wang knows how to speak English.,,
What is Ms. Wang's job?,,
Ms. Wang came today.,,
How does Ms. Wang get to school?,,
Ms. Wang speaks English very well.,,
The products of that company are very good.,,
He and I are the same height.,,
Are they all the same?,,
How old is she this year?,,
She only has five yuan.,,
Ms. Wang would not like to eat anything.,,
There is a bus stop near by.,,
"I don't know, and I don't want to.",,
There's nothing I want to drink.,,
I live near the school.,,
"""Why aren't you going?"" ""Because I don't want to.""",,
I wish I lived near your house.,,
Where does your little sister want to go? She wants to go to the toy store.,,
We will pass by your house.,,
I already asked everyone.,,
Are you afraid of heights?,,
I'm not tired at all.,,
You'd better go now.,,
That company shut down.,,
Please answer the phone.,,
I'll pick you up at your home at five.,,
Answer the phone.,,
I'll go pick him up.,,
"I listened, but I heard nothing.",,
"I'll tell you directly, ok?",,
I can count from one to ten.,,
She's very talented.,,
He succeeded.,,
He wishes that he already succeeded.,,
I can't remember.,,
I remember that he used to work at our company.,,
He can hardly write his name.,,
I am in first place!,,
What's your name?,,
"Excuse me, what is your student's name?",,
He achieved first place.,,
He feels tired easily.,,
Finding a job is easy.,,
This is my dictionary.,,
What does this word mean?,,
This isn't his dictionary.,,
Is there anyone who can pronounce this word?,,
She would like to buy a dictionary.,,
I have a dictionary.,,
"Excuse me, do you have a dictionary?",,
Mr. Zheng gave me a dictionary.,,
My reading is better than my speaking.,,
I don't have time to read.,,
For how long have you taught English?,,
Do you know how long the work day is there?,,
The problem has been solved.,,
"Allow me to introduce you, these are my parents.",,
My parents aren't old yet.,,
I am sure that he will be successful (at something).,,
Who can give me a hand?,,
Now it is not easy to obtain a visa.,,
"Before, it was very easy to obtain a visa.",,
"English is not easy, but it is interesting.",,
Obtaining a visa is very important.,,
When will you go to Hong Kong?,,
The flowers are fragrant.,,
She's sleeping soundly.,,
The school is far away from my home.,,
He lives very far from us.,,
I'll already be gone before you come back.,,
What do you think I've been doing?,,
He asked me to arrive at the company before three o'clock.,,
She appears old.,,
Don't hold the door open.,,
I will forever love my parents.,,
He and you both come from China.,,
Can I be friends with you?,,
He made many friends after he arrived in China.,,
His writes characters very clearly.,,
Is that clear?,,
She's my daughter.,,
We have two daughters.,,
Your daughter is very smart.,,
These clothes belong to my daughter.,,
I'll call you around five o'clock.,,
Please turn right.,,
He is the best student in our class.,,
"The car won't move (broken, stuck, etc.)",,
This problem is very simple.,,
"Other than here (in other places), it's not that simple.",,
"Except for him, the other people all slept.",,
Mom works in a hospital.,,
I enjoy taking pictures.,,
Can I take pictures here?,,
Please do not take photos here.,,
He's taking photos for them.,,
"Is Ms. Wang at home? No, she isn't. (She) is at the hospital.",,
Please give me a glass of wine.,,
Would you like another glass of liquor?,,
Please don't cry.,,
I want to cry.,,
We've graduated!,,
My classmate Mr. Bi has graduated.,,
Nobody (deeply understands) me.,,
You should study hard.,,
You worked too hard.,,
Chinese people work very hard.,,
He doesn't work hard.,,
He works very hard.,,
Each of them is very hard-working.,,
It seems interesting to me!,,
They went to see a love movie.,,
"I can't go, nor do I want to.",,
Don't believe a man who you don't know anything about his past.,,
He has no house to live in. He has no house in which to live.,,
There is no one inside the house.,,
This is my room.,,
Don't look into my room.,,
What is my room number?,,
The examination has begun.,,
It won't start before eight-thirty.,,
He began to look for a job.,,
We started to learn Chinese.,,
Have you started studying English?,,
I'm full.,,
What time does it start?,,
"As soon as she comes, we will begin.",,
He will go buy a television.,,
Do you like to watch TV?,,
I don't like to watch TV.,,
He was watching TV all night.,,
It's exactly six o'clock.,,
She kept crying all night long.,,
He's got an opportunity.,,
"He used to know her, but now they are no longer friends.",,
I don't love you anymore.,,
He is not what he used to be.,,
I'm from the U.K.,,
He's from England.,,
She's just bought a car.,,
Whose passport is this?,,
Where is your passport? At home.,,
This is my passport.,,
This is Ms. Wang's passport.,,
This is my plane ticket.,,
Could I see your passport?,,
This is Ms. Zhou's passport.,,
They knew each other from before.,,
"When you go, we'll all miss you!",,
Open your book.,,
They're singing.,,
Each of them sang a song.,,
There are many stores near my home.,,
That store has a lot of things you can buy.,,
This store does not have a lot of things you can buy.,,
She will go to the store to buy things.,,
My friend is going to the store.,,
This store has a lot of things you can buy.,,
"If I were you, I would also do this.",,
"If he put in a bit more effort, he might have already succeeded.",,
"If at that time, he had worked a little harder, he would have succeeded.",,
"If we don't eat, we'll just die.",,
I felt like I was dead.,,
He is a bit like his father.,,
He runs very fast.,,
"That student runs very fast, doesn't he?",,
He will be back soon.,,
The students learn things quickly.,,
He will be back very soon.,,
I'm very happy.,,
He is a professor.,,
"Yesterday, he left Beijing and went to Shanghai.",,
He's my younger brother.,,
My younger brother is not as tall as I was two years ago.,,
"I'm sorry, I was very busy. You are lying!",,
My younger brother is six years old.,,
Let me introduce my younger brother.,,
My younger brother is crying.,,
I have a younger brother.,,
They saw a movie yesterday.,,
She studied Chinese yesterday.,,
Was Ken at home yesterday?,,
Mr. Zheng came yesterday.,,
Mr. Zheng returned yesterday.,,
She likes little dogs.,,
This dog runs really really really fast!,,
I have a little dog.,,
Ken's dog is very big.,,
Are you sure?,,
He's afraid of dogs.,,
Please feed the dog every day.,,
"Oh, what is this?",,
I sort of understandd.,,
She raised a lot of questions.,,
"Is your father a businessperson? No, he's not. My father is a doctor.",,
She is a doctor.,,
We don't have a class on Sunday.,,
I don't have a class on Friday.,,
He doesn't have class on Thursday.,,
Do you have a class on Saturday afternoon?,,
We don't have class on Wednesday afternoons.,,
This is the house where I used to live when I was young.,,
I have ten U.S. dollars.,,
"If you had a million US dollars, what would you do?",,
He's very rich.,,
She said that she was happy/blessed.,,
I feel very happy/blessed.,,
Their lives are happy/blessed.,,
Our life is very happy/blessed.,,
They live a happy/blessed life.,,
She depends on this money to live.,,
His household is very happy/blessed.,,
She is my household tutor.,,
I dropped my money / I lost my money,,
"Do it when you have time, ok?",,
I don't know if I have time to do it.,,
"You finally gonna go, or not?",,
This matter is finally solved.,,
There are only two people who know this matter.,,
He has more money than he can spend.,,
Let me taste it.,,
These flowers are very pretty.,,
That is a pretty place.,,
Your clothes are very pretty.,,
My Chinese teacher is very pretty.,,
Soon it'll be light. (sky will be light),,
Her eyes are pretty.,,
I can't believe my eyes.,,
The problem is we can't use our car that day.,,
I've heard that Mr. Zheng is really smart.,,
"You may have heard. (literally, heard said)",,
I've heard that you need to look for work.,,
He is a computer expert.,,
He is an expert in economics.,,
A room has been arranged for you.,,
He put down the book on the table.,,
"I'll arrange it, I'll ask someone to go to your home and pick you up.",,
There's a glass of liquor on the table.,,
There's a policeman over there.,,
The police have come.,,
She hasn't heard this news yet.,,
