Learning a foreign language well isn't easy.,,
The regular eight o'clock bus arrived early today.,,
The mom is worried about her child's health.,,
Global warming is causing people to worry.,,
My dad must have been handsome in his youth.,,
Zhou Jun has devoted herself to working as a teacher.,,
The sun is shining on the tree leaves.,,
The tree leaves have fallen to the ground.,,
The leaves are very green.,,
What a dictionary says is not always right.,,
Can I use your dictionary?,,
This is my dictionary.,,
I always keep a dictionary close at hand.,,
I cannot do without this dictionary even for a single day.,,
They say love is blind.,,
This is a braille book.,,
"I'm already full, thank you. I've had enough, thank you.",,
He ran into an old friend.,,
"Quite by chance, I ran into my old friend in the airport.",,
The old friends haven't met for a long time.,,
Let me introduce my old friend.,,
"Allow me to introduce you, this is my old friend.",,
They've been to many places in their lifetime.,,
I'm going to visit my teacher.,,
I'd like to visit your country some day.,,
I didn't call on him because I had a cold.,,
He holds a Chinese passport.,,
I have a large amount of foreign exchange.,,
He's steaming rice.,,
Drawing can promote brain development.,,
Do you know how far it is from the station to city hall?,,
My foot has become swollen.,,
He shot at the enemy.,,
We are blowing out the candles together.,,
She's about to blow out the birthday candles.,,
Please arrange these candles in order.,,
The candles are lit.,,
The horn is too loud.,,
Don't speak with the megaphone aimed at me.,,
"When Mary was spoken to by a stranger, she was at a loss for words.",,
I thanked Mary for her help.,,
Was this letter written by Mary?,,
That can't be Mary. She is in hospital now.,,
Mary visited many places during her vacation in China.,,
Labor in Mainland China is cheap.,,
Society should cultivate an excellent labor force.,,
Immigrants have melted into the American society.,,
I hear he is good at mahjong.,,
I'm so dumb... I'm trying to explain things to you that I don't understand myself.,,
Please check the boxes on the form.,,
She is writing on the chalkboard.,,
He wrote the web address on the blackboard.,,
Ann wrote something on the blackboard.,,
He and his assistant were both injured.,,
That is much too expensive.,,
He raised his head and looked up.,,
Do you normally like doing sports?,,
Who is your favorite TV star?,,
There are many dictionaries on the bookshelf.,,
He takes a book off the shelf.,,
She placed the book on the bookshelf.,,
People's questions shouldn't be ignored.,,
He's counting the cash.,,
I think it impossible for me to write a novel in French.,,
It is cruel of him to say such things to her.,,
He's sprinkling the lawn.,,
The lawn is very beautiful.,,
Ken is going to the United States at the end of July.,,
He has great potential.,,
The teacher said he has great potential.,,
She took a deep breath.,,
The guitar string broke with a snap.,,
This river is too dirty. It needs to be treated.,,
That President governed America very well.,,
Sweat is very salty.,,
I like watching comedy movies.,,
This is a comedic movie.,,
This is a comedy.,,
Only if he goes. Else I won't go.,,
Everyone considers Guilin to be a beautiful place.,,
Did you like it? I liked it a lot. Guilin is very pretty.,,
There are a lot of people on the beach.,,
The color of the puppy's fur is as white as snow.,,
What time does she go to work?,,
What time does Ms. Zhou go to work?,,
What time does your little sister go to school?,,
What time do the students start school?,,
What time do you go to school?,,
What time does your little brother go to school?,,
I paid two thousand yen for the book.,,
She's eating grapes.,,
He's picking grapes.,,
I want to go to Lhasa.,,
I made a call and ordered a pizza.,,
The horses are running.,,
You must not run in the school buildings.,,
This slope is quite flat.,,
They're mocking each other.,,
There's no love without jealousy.,,
They are jealous of our success.,,
He was invited to be the chairman of the club.,,
She's a member of this club.,,
"Mr Johnson, president of the club, will soon come.",,
This is a fitness club.,,
She's become a fitness coach.,,
"He spoke too much, so his throat is sore.",,
My throat feels dry.,,
The books on the shelf are arranged in good order.,,
What a lonely world it would be with you away!,,
A fire has started here.,,
The fire caused a lot of damage.,,
The fire is under control.,,
The fire is currently uncontrollable.,,
Fires are very dangerous.,,
I made it to the station in time.,,
He is very honest - I have confidence in his work.,,
He is an honest guy.,,
A man must be honest.,,
She bought her boyfriend a tie.,,
Your tie is not straight.,,
Don't pull my tie!,,
She has a fever.,,
One plus one equals two.,,
There are while lines drawn on the field.,,
She is eating cookies.,,
Take as many cookies as you want.,,
He had a bite of the cookie.,,
He's been bitten by a mosquito.,,
The little kids are drawing.,,
He is drawing on the wall.,,
He wants to change US dollars into RMB.,,
He changed dollars into euros.,,
What's today's exchange rate for US dollars to RMB?,,
The sun is shining on the ground through the leaves of the big tree.,,
The large tree has been cut into two sections.,,
Peter gradually adapted to life in China.,,
He's a litigation lawyer.,,
The teacher teaches us to recite the words.,,
She wants to get away from him.,,
Stock prices declined these past few days.,,
The price of rice has come down.,,
The stock market fell.,,
She is an overseas Chinese.,,
He is an overseas Chinese.,,
His grandfather is an overseas Chinese.,,
He was insulted.,,
My mom is frying fish.,,
We took turns driving.,,
Don't hide this from me.,,
His room was in disorder.,,
"According to statistics, the world's population is 6 billion.",,
My grandfather is going to be sixty soon.,,
The People's Congress of China is about to open.,,
We conduct our business in accordance with the contract.,,
"According to the Constitution, a President can only serve for 4 years.",,
The Constitution is the fundamental law of a country.,,
This judge handles matters very fairly.,,
He is selling insurance to us.,,
He sells cars.,,
She's pitching products to customers.,,
This store has lots of discounted goods.,,
He already compared the prices in all the stores.,,
The government used incentives to attract foreign investment.,,
"I forgot to bring a pen,could you lend me yours?",,
"To study Chinese, you need to speak a lot, and practice lot, then it's ok.",,
They mutually coordinated to complete the job.,,
People exchange gifts at Christmas.,,
They hugged each other.,,
They hugged each other lovingly.,,
Saying it this way makes it sound very logical.,,
Keep the window closed.,,
Red chili peppers are very hot.,,
I particularly don't like to eat dried tofu with green peppers.,,
Ms. Wang sometimes eats pork fried with red pepper.,,
"Don't be nervous, relax, relax!",,
I promise I'll come to work on time.,,
From now on I will go to work on time.,,
He was perplexed by this problem.,,
This matter causes me perplexing trouble.,,
This problem puzzled him for many years.,,
Diamonds represents eternal love.,,
This diamond is real.,,
This diamond weighs ten grams.,,
This diamond is not real.,,
This diamond is very high in value.,,
The soldiers are defending their country.,,
Soldiers protect our nation.,,
Where can I buy a notebook?,,
This is a notebook.,,
Do you have a notebook?,,
I want some cake.,,
"You could be right, I suppose.",,
I am not a rich person.,,
I lost my credit card.,,
He lost his wallet.,,
I am looking for my lost watch.,,
He discovered that this is a counterfeit bill.,,
Iraq is located in the Middle East.,,
"If the river becomes polluted, the fish will die.",,
The river water is rising.,,
There was heavy rain yesterday and the river has risen.,,
The stock market is trending upwards.,,
This warehouse is very big.,,
Let's take a group photo.,,
"China has 5,000 years of history.",,
Continue working hard and strive to master Chinese as soon as possible.,,
I long for my dream to come true soon.,,
She's drawing the bow.,,
"If you are not too picky, you can find a job.",,
Only through persistence can you consolidate the effects of working out.,,
She would like to try on the purple shirt.,,
Don't harass me with telephone calls.,,
She was harassed.,,
He's standing at the dais giving a speech.,,
The teacher is teaching a class.,,
This is their wedding ceremony.,,
They held a magnificent wedding.,,
He's very satisfied with his salary.,,
He has surrendered to the police.,,
He was forced to surrender.,,
What shall I do (about that)? I said to myself.,,
In Changchun the winter weather is too cold.,,
Things in Changchun are not very expensive.,,
He's receiving clients.,,
"According to the lowest reckoning, it will cost thirty thousand yen.",,
He betrayed me.,,
The boss scolded him because of his mistakes at his job.,,
The game has been suspended due to rain.,,
The President received full support from Congress.,,
The President gained the full support of the Congress.,,
Congress is investigating that case.,,
"Somebody reported him, the police are investigating him.",,
The teacher feels happy that the students are working hard.,,
Acid rain is not a natural phenomenon.,,
It would be great if I were an angel.,,
She's very tired.,,
They're arguing.,,
She was always quarreling with her brothers.,,
Husbands and wives should avoid quarrelling.,,
It is unwise to argue in front of the children.,,
This is my treat.,,
"He won a prize, so we told him to treat us to a meal.",,
"Although he didn't get the prize, he maintained a good state of mind.",,
"During the competition, he won awards again and again.",,
Human kind has many ethnic groups.,,
He's good at soccer.,,
Several years ago I was good at painting.,,
He is no good at making friends.,,
He is not a good driver. He is bad at driving.,,
I am not good at telling jokes.,,
Ms. Guo is very good at taking photos.,,
Ms. Guo's listening comprehension has improved.,,
Criminals are kept in prison.,,
He is an evil criminal.,,
The government helped a lot of refugees.,,
Our country is willing to help African refugees.,,
Refugees in Africa are seeking help.,,
Assistance to Africa requires significant funding.,,
This flood has affected a large area.,,
It's dark outside.,,
I don't like to go out after dark.,,
You must come back before it gets dark.,,
He's writing an article.,,
I wish you a pleasant trip.,,
They are taking a brief rest in the middle of their journey.,,
The courage to admit mistakes is his strength.,,
The little girl is picking up the toys.,,
Such secrets are always eventually revealed.,,
She has a part-time job in a restaurant.,,
China is rising.,,
This door is very shabby.,,
His life is very degenerate.,,
She talked childishly.,,
It is time you left off your childish ways.,,
This is the country's border.,,
The street was blocked off.,,
The teacher's encouragements spurred him to constantly improve.,,
Pressure from the people impelled the government to improve the traffic problem.,,
I'm in line to buy a ticket.,,
What are the total earnings for this month?,,
There's a café nearby.,,
Near my house is a small café.,,
He's a spy.,,
I teach at this primary school.,,
She decided to go in person.,,
She should go in person.,,
I made a trip to Berlin.,,
His nose is bleeding.,,
This is their new house.,,
We've bought a new house.,,
The earth is constantly evolving.,,
There are people pirating textbooks.,,
"Taking a risk, he reported his boss' wrongdoings.",,
The cookies are crisp.,,
I would like to try on the gloves.,,
I have a bad headache today.,,
There are many trees on both sides of the road.,,
Don't buy pirated software.,,
This factory produced pirated books and was shut down.,,
No wonder she didn't show up to see him off. They broke up.,,
My dad's love and caring for me is no less than my mom.,,
His girlfriend has a bright and cheerful personality.,,
The price of pork is having a rising trend.,,
"If I can serve you, I'll feel very very happy.",,
They want a loan to buy a house.,,
Buying a house requires lots of money.,,
"He cannot buy a car, still less a house.",,
The price of commodities has increased.,,
"This year, commodity prices are rising comparatively fast.",,
The price of commodities has fallen.,,
It is said that prices in New York are very expensive.,,
It is said that he got into Tokyo University.,,
The price of commodities is showing a declining trend.,,
The price of commodities is showing a tendency to decline.,,
The beautiful scenery was revealed before the tourists.,,
It is said that the weather in the mountain changes easily.,,
People living in the mountain often get harassed by monkeys.,,
Is death the only release?,,
They solved the problem through negotiation.,,
This sculpture is very famous.,,
My hobby is playing badminton.,,
He met with frustrations.,,
This failure set back his confidence level.,,
The recent frustrations made him change.,,
His girlfriend's hobby is practicing fengshui.,,
I'm going to the convenience store to buy something.,,
Transportation in this city is very convenient.,,
The little girl is playing with the duck.,,
He's hurt his knees.,,
It is clearly written in the treaty.,,
I want to lose weight even if it means not eating.,,
The company has a monopoly on the world's computer market.,,
If there is an opportunity I would like to visit America.,,
The disaster caused many people to starve to death.,,
"Because no one looked after it, the puppy starved to death.",,
She's holding her boyfriend's arm.,,
"In order to prove they were correct, they began to debate.",,
Lawyers of the two sides debated in court.,,
The court puts criminals on trial according to the law.,,
Courts are the place to put criminals on trial.,,
The judge tries cases in accordance with the law.,,
The two of them are practically identical.,,
He's practicing a new tune.,,
She's happily humming a song.,,
He confirmed that something was wrong with his car.,,
He lost his way in the woods.,,
He took his entire inheritance and donated it to society.,,
I'm hurrying to work.,,
The facilities in this room are very useful.,,
"The motto of the service industry is ""the customer comes first"".",,
Do you mind if I open the window?,,
Would you mind if we interview you?,,
Director Deng considers this meeting to be important.,,
That's a conspiracy.,,
Drugs harm one's health.,,
The government decided to strongly crack down on drug dealing.,,
I hear that the foreign students already know a number of Chinese characters.,,
"The rain stopped, and the ground is very wet.",,
It just rained heavily. The road is very wet.,,
The weather is very humid.,,
They are opening up new land.,,
The police detained him.,,
Please charge this to my account.,,
I go climbing a lot.,,
They appointed to go climbing on Sunday.,,
Studying Chinese requires the formulation of a long-term plan.,,
The One Child Policy is necessary in the long run.,,
The government implemented the One-Child Policy.,,
China implemented the One Child Policy in most areas.,,
May I pay by check?,,
"On this point, I have different ideas",,
It is expensive running this car.,,
She's wearing a brand-new skirt.,,
Can I try on this pair of jeans?,,
The children are ardently chasing each other in the meadow.,,
A lot of boats are moored at the port.,,
China is a rather stable country.,,
Ordinary people want a stable life.,,
My ancestors came from Britain.,,
My dad is very very involved in the stock market now.,,
He took a vacation.,,
He was sick and asked to take one day off from the teacher.,,
They're planting trees.,,
I dug a hole and am about to plant a tree.,,
"In 1939, Germany occupied Poland.",,
"In 1939, German invaded Poland.",,
Don't make excuses for being late.,,
This road is very narrow.,,
This cell phone can make international calls.,,
My car needs repair.,,
He's repairing the air-conditioner.,,
He is repairing his bicycle.,,
This bike needs to be repaired. This bicycle needs repairing.,,
The computer's hardware is broken and needs to be repaired.,,
She's playing the violin.,,
Computers have many uses.,,
Don't conceal what you feel about it.,,
I'm going to the tea house.,,
Mr. Chen is going to the tea house.,,
We are at the teahouse.,,
He can teach very well.,,
Can foreigners teach at a university in China?,,
The students like the teacher's way of teaching.,,
He teaches at a middle school in Shanghai.,,
The Chairman of the Board held a board meeting.,,
This room is very tidy.,,
There's a ping pong ball on the desk.,,
He's playing ping pong.,,
I like playing ping-pong.,,
It is very meaningful to learn Chinese well.,,
The ancient emperors lived here.,,
"In ancient China, the emperor's order was like a decree.",,
China used to have an imperial system.,,
She is doing an experiment with the instrument.,,
I can ride a horse.,,
I'm going to throw out the garbage.,,
"Before, she had been an editor.",,
There is an old man in the park.,,
He refuted my point.,,
These articles are all hand-made.,,
Many people are involved in this case.,,
This case involved many people.,,
The Minister is involved in this case.,,
He is the class advisor while simultaneously being the language teacher.,,
Heavy snow covered the ground.,,
The whole country was covered with snow.,,
Heavy snow has covered the roads.,,
The roof is covered with snow.,,
He lives an extravagant life.,,
Can the red team beat the blue team?,,
He ran very fast and disappeared quickly.,,
"On his arrival in London, he sent me a telegram.",,
Why do not you ask your teacher for advice (about this)?,,
There's a war on the border.,,
Going to war is not a good thing.,,
People don't like wars.,,
The high building can be seen from the window.,,
There are many high buildings in the city center.,,
What is that big building in front of us?,,
"That is a high building, is not it?",,
Wood is a very good construction material.,,
Wood can be used as a construction material.,,
He broke his promise.,,
This field is very beautiful.,,
They interfere with each other's business.,,
The government confiscated the drugs.,,
There are a lot of pigeons in the square.,,
The dove is flying in the sky.,,
Doves are a symbol of peace.,,
She's got some coins.,,
I save one coin every day.,,
The coin is made of bronze.,,
We already made reservations at a restaurant.,,
I reserved a room in this hotel.,,
We want to reserve a seat.,,
Hong Kong is a part of the territory of China.,,
HK is Chinese territory.,,
The military safeguards the territorial integrity of the country.,,
"The CPC said, ""We will definitely protect the integrity of our territory.""",,
She's played a complete piece.,,
"A large population base, combined with the famine, caused a starvation problem.",,
The famine expanded.,,
They're living a leisurely life.,,
That object is very valuable.,,
Fishing is forbidden here.,,
He is an expert at fishing.,,
"As soon as he's free, he goes fishing.",,
My older brother and I enjoy fishing.,,
I went fishing in the river yesterday.,,
There are many peddlers selling vegetables by the riverside.,,
The police controlled the accident area.,,
God helps those who help themselves.,,
They went to the countryside to vacation.,,
The meat has been stewed till it's very soft.,,
Ms. Sun feels very very ashamed.,,
The typhoon is coming.,,
The typhoon blew down many houses.,,
A typhoon is coming.,,
The typhoon is gone.,,
This place is frequently hit by typhoons.,,
He loves smoked meat.,,
The canyon is very beautiful.,,
She's a rich lady.,,
We have to retreat.,,
She works very hard.,,
I'm peeling an apple.,,
Going to bed early and getting up early are fine habits.,,
Ms. Sun usually gets up early.,,
He can stand on his own now.,,
He told his father of his remorse for his mistakes.,,
Chase that car up ahead.,,
He is sitting on a rock.,,
A rock fell from above.,,
"Next, I wish to discuss the negative influences.",,
This matter has a negative influence.,,
The film is going on.,,
He lives far from the Summer Palace.,,
These rabbits were slaughtered.,,
"The road is slippery, so please be careful.",,
Be careful of the point of the needle.,,
Please raise your hand if you want to answer the question.,,
He raised his hand and took an oath.,,
This toy is made of tin.,,
The children line up to board the school bus.,,
Palestine is in the Middle East.,,
There are big problems between Israel and Palestine.,,
He sold his own car without hesitation.,,
You're such a jerk.,,
He's carrying the wooden boards on his shoulder.,,
She is deeply in debt.,,
Eating more pears is good for your health.,,
The school invited a new chemistry professor.,,
He is an expert invited by our school.,,
He's a show-off.,,
She was entranced with the music.,,
The price is not reasonable.,,
He's antisocial. He is unsociable.,,
This paper fails to meet the standard.,,
AIDS is a horrible disease.,,
The teacher made a list of excellent students.,,
The police officer is escorting the prisoner.,,
Foreign currency can be exchanged here.,,
We should love and protect our planet.,,
We should love and protect all lives.,,
Please love and protect the natural environment.,,
The father tells his child to be careful.,,
He finally became the president of IBM.,,
Welcome!,,
Welcome to Wu Mei supermarket.,,
The Great Wall has a very long history.,,
This city has a long history.,,
Shaanxi has a long history.,,
Solar radiation will harm the skin.,,
The wheel spokes of the car were damaged in the crash.,,
His health has recovered.,,
Get well soon!,,
The children are playing in the park.,,
We were watching the child at play.,,
The children got together to play.,,
This company monopolized the steel market.,,
We should take more supplemental vitamins.,,
She took her glasses off.,,
She's scratching the little dog.,,
Her forehead is itching a bit.,,
She feels that life is empty.,,
"When there is strong wind, boatmen do not leave the port.",,
It's very windy today.,,
The typhoon is blowing violently.,,
"The wind blew too hard, there was no way for them to play in the park.",,
"It's so windy, her hat was almost blown away.",,
My brother is holding a camera in his hand.,,
He isn't going to buy a camera.,,
This is a beautiful valley.,,
The Beijing team won this tennis match.,,
She liked tennis and became a tennis coach.,,
I am a member of the tennis club. I belong to a tennis club. I'm in the tennis club.,,
He is rather poor at tennis.,,
He can play tennis very well. He was very good at playing tennis.,,
He played tennis.,,
He is a good tennis player.,,
The climate of the desert is very dry.,,
"It gets very humid here in the summer. In the winter, on the other hand, it gets very dry.",,
There's a pair of rubber gloves here.,,
Tires are made of rubber.,,
The national flag has been raised.,,
She's holding an American flag.,,
There is no denying that she is very very efficient.,,
"It is inevitable that I go to France someday, I just don't know when.",,
Tiananmen Square is in the center of Beijing.,,
They have achieved outstanding results.,,
The mom is worried about her son's autism.,,
He's changed his schedule.,,
You guys talking has affected my listening in class!,,
You should concentrate when in class.,,
This palace is very luxurious.,,
He committed the crime of corruption.,,
The government should deal with the problem of corruption.,,
"Using his position, he misappropriated a lot of money.",,
He was about to be inundated by the water.,,
"It's not much of a surprise, is it?",,
"The child has graduated, and his parents are pleased.",,
Bad guys always like to cheat people.,,
"He said he did not enter the room, which was a lie.",,
She's got cancer.,,
He got skin cancer.,,
He got cancer.,,
His cancer disappeared.,,
Her son died of cancer when still a boy.,,
Many of the workers died of hunger.,,
Many children die of starvation in Africa.,,
Traditional Chinese medicine is very bitter.,,
I wasn't busy last week.,,
Alice has had a cold since last Sunday.,,
Do you participate in any community activities?,,
Where is the subway station?,,
"Excuse me, where is the subway station?",,
Ms. Wang is at the subway station.,,
Where is the subway station located?,,
That is the entrance to the subway.,,
She's waving to me.,,
She waved at me before she got on board the plane.,,
The police and the demonstrating people clashed.,,
The thief rapidly fled into the crowd.,,
She travels to Paris when she gets time off from work.,,
He is the manager of the marketing department.,,
We've made a fortune.,,
"He got rich after earning 5,000,000 yuan this year.",,
People have the right of assembly.,,
We assembled in the public square to demonstrate.,,
Xiao Ming often goes to the sea to swim.,,
The teacher warned Xiao Ming not to hit other classmates.,,
Xiao Ming is searching in his bag for a pen.,,
He wants to overthrow the government.,,
Amereica elects a President one time every four years.,,
You will soon get used to eating Japanese food.,,
My dad participated in the cooking contest and won the first prize.,,
This misunderstanding ruined their love.,,
Her emotions are very fragile.,,
They have a close relationship.,,
I can't convey my feelings in words.,,
The result of the election expressed the people's will.,,
The heater doesn't work.,,
A fondness for playing games is in the nature of children.,,
Habit is second nature.,,
It's in animals' nature to protect their young.,,
