"During the rainy season, there are floods.",,
He points out flaws in the construction of the house.,,
Send me an email.,,
Please send Ms. Zhou an email.,,
I should send Ms. Wang an email.,,
"When he retired, his son took over his business.",,
He was hit and injured.,,
I'm doing my homework.,,
Doing homework is very boring.,,
She is a student in the foreign languages department.,,
Snowflakes are drifting through the sky.,,
The company finally makes a profit this month.,,
What does this news bode?,,
Teachers deserve to be lauded.,,
The party was put off for a week.,,
The little boy is floating on the surface of water.,,
I am watching the luggage for my dad.,,
The government has a huge deficit.,,
I was in the red this month.,,
We went into the red last year.,,
Our country has a huge deficit.,,
"In hard times like this, no ordinary effort can get our company out of the red.",,
The deficit is growing greatly.,,
We denounce domestic violence.,,
Domestic violence is an ethical issue.,,
It is no use arguing with her.,,
You can have a ride on my motorcycle.,,
They're moved to tears.,,
There's no water in the bottle.,,
The mom wraps the baby in the towel.,,
Private cars are common in China now.,,
He's savoring the taste of the wine.,,
They're planting rice.,,
He participated in the fundraising.,,
Giant pandas love to eat bamboos.,,
The machine is digging the soil.,,
He's bribing government officials.,,
Bribery is a form of criminal behavior.,,
He is trying to bribe the person in charge.,,
The problem of bribery is severe.,,
That official accepted bribes.,,
The sheep is kept inside the fence.,,
The garden was surrounded by a wooden fence.,,
I didn't expect that so many friends would come.,,
Cockroaches are really disgusting.,,
Cockroaches are disgusting.,,
It's minus ten degrees today.,,
She is a politician.,,
Bad political figures are called politicians.,,
The train sets off at six.,,
The recession has led to a problem of unemployment.,,
The CPC restated the One China Policy.,,
Mainland China restated the One-China Policy.,,
He restated the importance of this matter.,,
He's shaving his beard.,,
Cheers!,,
Everybody cheers and wish him a happy birthday.,,
A thief stole his wallet.,,
Their wedding ceremony was held outdoors.,,
Environmental protection is a cross-border issue.,,
Liu Xiang broke the world record in the 100 meter hurdles.,,
He's angry with himself for his stupid behavior.,,
He's very rebellious.,,
He's the kind of person that people respect and hold in awe.,,
"Perseverance, as you know, is the key to success.",,
She's choosing tomatoes.,,
He's wasting time.,,
"Danger past, God forgotten.",,
The only access to the village is from the river.,,
Today's weather is bright and clear.,,
"If it wasn't for having your help, I couldn't have completed this work.",,
The coal is burning.,,
Charcoal is black.,,
She's holding a fan.,,
You have to change trains at Shibuya.,,
This matter involved many sides.,,
This matter involved his dad.,,
The financial minister has put out this year's budget report.,,
She's been humiliated by her classmates.,,
They accepted my advice.,,
"Taking a bath in summer is very refreshing [lit., ""cool""]. .",,
It is good to be a winner.,,
She forgave the boy for his rudeness.,,
She put on her backpack and went mountain climbing.,,
This is the Temple of Heaven in Beijing.,,
It started to rain heavily just when I stepped out the door.,,
I bet it won't rain today.,,
She is drawing a circle on the beach.,,
She has a simple and honest personality.,,
"Generally speaking, the students have made quick progress in their studies.",,
Ancient Chinese people used writing brushes to write.,,
Chinese use writing brushes to write calligraphy and draw pictures.,,
He works in a transnational company.,,
Xiao Li works in a transnational company.,,
It's the busy season for tourism now.,,
The sun appeared on the horizon.,,
She jumped over the barricade on her horse.,,
The horse effortlessly jumped over the barrier.,,
The horse jumped over the hurdle.,,
Japan is located to the east of China.,,
She is interested in cooking.,,
The ladybug is a beneficial insect.,,
She's packing.,,
She's putting away the dinnerware.,,
There's a set of silver tableware on the table.,,
He's delivering the chief executive's report on affairs of state.,,
The doctor is scrupulous about every detail.,,
This place is very pleasant.,,
The appearance of these buildings is very similar.,,
You're hired.,,
Beibei lives in a happy/blessed household.,,
A constitution is the basic law of a state.,,
He is a good salesman.,,
Salesmen sell goods.,,
She's convulsed with sobs.,,
I'm going to the library to borrow some books.,,
Thousands of foreigners visit Japan every year.,,
"Some expressways have toll stations, while some do not.",,
He's illiterate - he can't read characters.,,
There are a lot of illiterate people in that nation.,,
Traffic on the highway is proceeding in an fine fashion.,,
Roses belong to the Rosaceae family.,,
She feels terrified.,,
In Shenyang what bar is particularly quiet?,,
His hands are covered with chocolate.,,
His lips and face are covered with chocolate.,,
Terrorists like to kill.,,
The government arrests dissidents.,,
"He is the dissident among us, which makes him very unique.",,
The police consider Xiao Zhang to be a suspect for the murder.,,
The drought this year is severe.,,
It hasn't rained for a while. It looks like there will be a drought.,,
The drought is very severe.,,
He ate Sichuan pickled vegetables yesterday.,,
He detests his boss.,,
My dad and I are going to hunt together.,,
He likes hunting. He likes to hunt.,,
He's running toward the finish line.,,
My daughter's room is a mess.,,
Mr. Yang is at the tea house.,,
Mr. Yang will go to the dormitory.,,
Last weekend Mr. Yang went to Changchun.,,
This is Mr. Yang's umbrella.,,
Mr. Yang does not speak Japanese very well.,,
How does Mr. Yang study English?,,
Mr. Yang should take a rest.,,
Last weekend Mr. Yang was very busy.,,
Is Mr. Yang single?,,
Do you know Mr. Yang?,,
Mr. Yang knows how to speak many languages.,,
Mr. Yang does not like to drink beer.,,
Is Mr. Yang's work difficult?,,
I've heard that Mr. Yang is a shy person.,,
Mr. Yang does not like his work.,,
Mr. Yang went to Qingdao last week.,,
Mr Yang is going to go home.,,
Mr. Yang is with his wife.,,
I've heard that Mr. Yang is looking for a girlfriend.,,
Mr. Yang does not like lazy people.,,
Mr. Yang would like to go to the movie theater.,,
I'm going to the counter to pay.,,
She's looking into the mirror.,,
The Minister of Economics held a press conference.,,
Today's press conference will be held in the school auditorium.,,
The Great Wall is one of the seven wonders of the world.,,
About how much will I have to pay for all the treatments?,,
There are a lot of tall buildings in Shanghai.,,
She's sealing the paper box.,,
I read the book after I had finished my homework.,,
The ice cube is melting.,,
Your pulse is normal.,,
All Chinese set off firecrackers during the Spring Festival.,,
The plane has touched down.,,
My dad graduated from Harvard University.,,
He's a professor of biology at Harvard.,,
He boarded a plane bound for Los Angeles.,,
Los Angeles is in California.,,
They drive to Washington.,,
Rabbits breed rapidly.,,
That report mentioned the most sensitive topic.,,
Only a few TV programs are worth paying attention to.,,
It lives in a burrow.,,
The news broke his heart.,,
I cannot heal a broken heart.,,
The company hired her.,,
The tower is leaning.,,
Her apartment is near the Oriental Pearl Tower.,,
The carriage is very spacious.,,
The office is very spacious and bright.,,
She's a little deaf.,,
Lao Niu suspects that Xiao Ma told a lie.,,
He's very agile.,,
Xiao Mei often pays by credit card.,,
The government put out a stern declaration.,,
The teacher sternly criticized him.,,
Could you spare me a few minutes?,,
This small path leads to the top of the mountain.,,
The surface of this path is uneven.,,
How long do you need to prepare lessons for?,,
I got drunk. My goodness! You are an alcoholic.,,
Chen teacher should prepare a lesson.,,
He heard clearly the teacher's requirements.,,
He's very very stingy.,,
She passed out.,,
There are dog tracks on the shore.,,
She uses a rope to protect herself.,,
I utterly despise formal writing!,,
She takes a shower every day.,,
The shower is broken.,,
Chinatown is bustling.,,
She paid the rent for her car.,,
He's reading the latest news in the paper.,,
He's reading a newspaper.,,
I don't read newspapers much.,,
Music is not divided by national boundaries.,,
It's not easy to pronounce the tones.,,
This desk is made of wood.,,
Since she was young she has wanted to become a writer.,,
He's doing math.,,
He advocates capitalism.,,
The school encourages students to wear school uniforms.,,
Companies should maintain reasonable labor systems/regulations.,,
The laborers are instigating a strike.,,
There is a storm brewing.,,
Rice is a staple food.,,
He's copying some material.,,
He copied the software.,,
There are people who illegally copy software.,,
We shouldn't illegally copy study materials.,,
He copied the tape.,,
I copied my homework for the teacher.,,
The United States borders Canada.,,
The alley is very narrow.,,
He broke the law by stealing.,,
There's a village at the foot of the hill.,,
The church is at the foot of a mountain. The church stands at the foot of the hill.,,
We will (set off on our journey) in a moment.,,
Lincoln was a great statesman.,,
The American people mourned President Lincoln.,,
She's painting.,,
The guide is in front of us leading the way.,,
My studies have hit a wall.,,
I'm trying my best to save room for dessert.,,
The night market is bustling.,,
There are lots of delicious foods at the Beijing night market.,,
She is every bit as competent in her work as others.,,
This spoon is very dirty.,,
Mercy is the expression of love.,,
There are many shells on the shore.,,
I've found a shell.,,
The wheat has ripened.,,
Did ball go in? (hit the basketball shot),,
The new legislators made their first public appearance.,,
He turned to the next page.,,
She turned to the next page of the book.,,
"He doesn't get along with his coworkers, because he is very arrogant.",,
This is a very thorny problem.,,
"During class, the teacher mentioned the homework from last time.",,
"They're comparing notes on golf technique (lit., ""ball playing techniques"").",,
We're confident of victory.,,
He's making an outline.,,
Stir the flour for a while.,,
"To cross the street, one should use the crosswalk.",,
The tall one of the group is my older brother.,,
Which flight is he on?,,
There are five flights from Beijing to Shanghai every day.,,
Do you like your roommate? I like him. He is an active person and he is very well traveled.,,
The walnuts have been crushed to pieces.,,
There has been nuclear proliferation.,,
A herd of elephants will migrate to a place with water.,,
Is it right for a doctor to decide when someone should die?,,
A brilliant future lay before him.,,
She's choosing plums.,,
The old man is taking a walk in the woods.,,
The old grandpa looks very kind.,,
They're partners at work.,,
She's cooking food.,,
The view here is like a wonderland.,,
This company is short-handed.,,
Can you imagine walking on the moon?,,
That was the first time that a man walked on the moon.,,
The sweet potatoes are fresh.,,
He pulled aside to let a truck through.,,
He withdrew his hand from the table.,,
Children are protected by their parents.,,
He seeks political asylum.,,
He contrived a means of speaking to Nancy privately.,,
The hotel is equipped with an automatic revolving door.,,
In which year was the People's Republic of China established?,,
The People's Republic of China is shortened to China.,,
Shu is the abbreviation for Sichuan.,,
This is a newly-built residential complex.,,
Hitler once massacred Jews.,,
Israel is a country where Jews are the majority.,,
People often fight for minor interests.,,
He often gets drunk.,,
The lost fishing boat made a safe return to harbour. The fishing boat that had been missing returned to its port safely.,,
He's an old fisherman.,,
The fisherman is drawing in the fishing net.,,
I was late as a result of the train delay.,,
Some flights are delayed.,,
The flight departure time was delayed.,,
The plane is about to take off.,,
This is the flight to America.,,
The cat's paws are white.,,
What greater misfortune is there than to go blind?,,
I have a handgun.,,
Please give me a roll of toilet paper.,,
The toilet paper has run out.,,
The toilet paper in the bathroom has run out.,,
"After singing, we then danced.",,
Indians can open casinos.,,
Lao Wang hid a valuable painting in his house.,,
Children should due their duty to their parents.,,
The oil leaked and polluted the ocean.,,
She punched him once and he fell over.,,
The paper's been torn apart.,,
"In the winter, I like going to a bathhouse to have a bath.",,
Tell me all about your plan.,,
There are some bread crumbs on the table.,,
Xiao Jing sincerely apologized to Xiao Li.,,
South Korea sincerely hopes that the two Koreas are reunified.,,
She smiled and winked at me.,,
The terrorists have taken the building.,,
The water froze into ice.,,
Now is the time for action.,,
The US is about to attack Iraq.,,
The general decided to attack the enemy at night.,,
She's a kindly old lady.,,
Xiao Mao is an honest child.,,
Xiao Mao likes playing basketball.,,
It is no use trying again.,,
"I hear that you are a shop assistant, is that right? No, that's not correct. I am a cleaner.",,
They are hanging onto the car window and looking out.,,
Lavender is purple.,,
The teacher is indignant at her behavior.,,
The director is a smart person.,,
This patch of woods is very thick.,,
I plan on reading A Fortress Besieged.,,
Ginseng is very valuable.,,
He graduated from Red Star elementary school.,,
The police accused him of committing a crime.,,
I have realized my dream of being a teacher.,,
My daughter walked towards me head-on.,,
She's a physician. (internal medicine),,
Saudi Arabia is a country in the Middle East.,,
There are many fishing vessels in the harbor.,,
Dad earns money to support the family.,,
I sustain my family.,,
"When we think of the traditional roles of men and women in society, we think of husbands supporting the family, and wives looking after the household and children.",,
She's playing a new piece.,,
He's pushing the car.,,
This model is definitely not suitable for the mainland and Taiwan.,,
The tears are flowing down her cheeks.,,
His hair style is really cool.,,
The hair style of the Beatles created a sensation.,,
God knows where he has gone.,,
"Peppers, onions and carrots are all vegetables.",,
My mom is cutting the onions.,,
Please be seated.,,
Swimming is her specialty.,,
They love each other very much.,,
They are getting more and more affectionate.,,
The old couple love each other very much.,,
She's a lovely little girl.,,
I can pay off my debts tomorrow.,,
She feels that the new American president is a person of strong character.,,
The little cat is meowing all the time.,,
I like bread spread with butter.,,
We eat butter on bread.,,
I ate bread and butter this morning.,,
"In making a cake, you must use eggs, butter and sugar.",,
Tonight's banquet was very lively.,,
It's difficult to balance a ball on your nose.,,
The company plans to fire 10 employees.,,
Stocks are constantly climbing.,,
She spent a good deal of money on her vacation.,,
He set aside a great fortune for his daughter.,,
In every single life there lies maternal love.,,
They only have one fishing pole.,,
A great deal of garbage has piled up here.,,
She's pretending to be an evil spirit.,,
The house was burned down.,,
She admires her superior very much.,,
The flood wrought havoc on the city.,,
She likes being looked at by boys.,,
Growing crops for farmers is very toilsome.,,
The crowd surged into the train station.,,
Kuwait is a country in Asia.,,
Iraq occupied Kuwait.,,
Iraq invaded Kuwait.,,
He can't get a handle on his work.,,
She yawned.,,
She died from an illness.,,
This factory manufactures cloth.,,
You can buy things at the airport tax-free.,,
This kind of Taiwanese fruit is tax-free.,,
This forest is very thick.,,
He is a real estate agent.,,
You can search for a broker to buy a house.,,
Next weekend Manager Lin wants to go to the sauna.,,
People within educational circles all support this plan.,,
Teacher Tian is very famous among educational circles.,,
She's narrow-minded and can't tolerate other people.,,
Economists predict the economy will recover.,,
Xiao Zhao's academic grades are outstanding.,,
The bandit robbed a bank.,,
His children were not with him at his deathbed.,,
The friend who I believed would pass the exam failed it.,,
The little child is ill.,,
The number of people suffering from heart disease has increased.,,
"He's laying [lit., ""sticking on""] ceramic tiles.",,
He's laying ceramic tiles.,,
The duck is already boiled thoroughly.,,
He dove into the swimming pool.,,
It's everyone's duty to defend world peace.,,
He broke this glass.,,
Sorry to interrupt you.,,
His girlfriend burst into laughter and he took the opportunity to propose.,,
This is really a miracle.,,
What time did you get up today?,,
I've stopped smoking as of yesterday.,,
She's determined to give up smoking.,,
He vowed to give up smoking.,,
I have successfully given up smoking.,,
Give up smoking!,,
Give up smoking if you want to live long.,,
His doctor advised him to give up smoking.,,
I wish I could give up smoking.,,
I advised my dad to give up smoking.,,
She'll never give up smoking.,,
My husband has stopped smoking for a year.,,
"In Taiwan, people usually make purchases using NT.",,
Today's exchange rate is 1 US dollar for 30 NT.,,
I need to see a doctor.,,
She's doing deep breathing.,,
He's utterly exhausted.,,
Jiuzhaigou's scenery is very beautiful.,,
These disaster victims are starving.,,
The UN pays close attention to the problems of disaster victims.,,
Many houses of the disaster victims collapsed.,,
I know how to row a boat.,,
I ordered a sandwich.,,
They ate sandwiches for lunch.,,
She is resting her chin in her hands.,,
I don't like garlic.,,
Do you have any condoms? Do you have a condom?,,
Bamboo poles are hollow in the center.,,
There is an economic conference in the last ten days of March.,,
"In the third part of this month, we can see a solar eclipse.",,
He looked for every possible means of escape.,,
The Middle East produces a lot of oil.,,
Korea produces ginseng.,,
She's cleaning the electric light.,,
Foreign guests stay at the national hotel.,,
We should host foreign guests with courtesy.,,
The Japanese Minister of Foreign Affairs has arrived in Beijing.,,
The pigs are kept in the pigsty.,,
The fans are cheering below the stage.,,
The pool is filled to the brim.,,
"In the pond, there are lots of red carp.",,
She is ashamed of her poor academic performance.,,
We need to protect the water resource.,,
A big famine occurred in Africa.,,
This is the most massive structure I have ever seen.,,
They're junior middle school students.,,
"Excuse me, allow me to point out three errors in the above article.",,
See above.,,
Have you ever had any serious illness?,,
Both sides are striving to cooperate.,,
Water is seeping out.,,
Poor people have hard lives.,,
He went sketching in the suburbs.,,
The government will launch a new policy soon.,,
There is dew on the leaves.,,
The Middle East region has a great need for fresh water.,,
The thief is stealing her bag.,,
A bad guy robbed him of his belongings.,,
"When going out, you should keep an eye on your belongings.",,
There are many ancient buildings in China.,,
He won the horse race.,,
The bus will take time.,,
Beer is very delicious.,,
This store is having a sale on its clothes.,,
The department store offered discounts.,,
The flower has withered.,,
Their mom allowed them to eat ice cream.,,
Everyone gave their sincere congratulations to the bride and groom.,,
There are many beautiful mountains and rivers in China.,,
The 'hollowness' inside bamboo represents modesty and humbleness.,,
She's knitting a scarf out of yarn.,,
She's crocheting.,,
"He worked too hard, and became sick.",,
He is carrying a leather valise.,,
The leather suitcase is stuffed with clothes.,,
I'll give you a prescription.,,
I hope that mankind will stay free from from plagues.,,
The plane's departure has been delayed.,,
This elderly woman is my grandmother.,,
He said hello to the woman. He saluted the lady.,,
Xiao Hua gave me a good impression.,,
Most Chinese are of the yellow race.,,
How do white people treat other races?,,
He wants to see the Temple of Heaven.,,
When will you come back? It all depends on the weather.,,
Einstein made a great contribution to mankind.,,
She's energetic.,,
He's a high-ranking general in the army.,,
Nanjing was once the capital of the Southern Song dynasty.,,
He's pleading for his wife's forgiveness.,,
She loves eating vegetarian food.,,
This plan is temporarily suspended.,,
These cars are poor sellers.,,
Please turn on the light.,,
Did you remember to turn off the iron?,,
He was standing at the street corner.,,
Silkworms produce silk.,,
Silkworms eat mulberry leaves.,,
His hair is very thin.,,
Stand the ladder against the wall.,,
He can't tell the true from the false.,,
Math is the only subject in which he can't do well.,,
These two companies signed a contract.,,
She especially likes to eat spicy Chinese cabbage.,,
The electric train is moving along the track.,,
Marijuana is a type of drug.,,
Frozen foods are very convenient.,,
Don't interfere in my affairs.,,
He depends on people's charity.,,
Drugs brought about his downfall.,,
Jackie Chan is very famous.,,
Jackie Chan is very famous in the West.,,
The official is staying at this hotel.,,
The leaves fall in autumn.,,
The teacher is teaching the children the stories behind proverbs.,,
"A rolling stone gathers no moss is a saying. ""A rolling stone gathers no moss"" is a proverb.",,
She participated in a beauty contest.,,
She has been selected Princess of the beauty pageant.,,
Inappropriate items should be removed.,,
The supermarket has all types of fruits.,,
A streak of lightning lit up the sky for a split second.,,
The golf ball rolled into the hole.,,
All prisoners in this jail are political prisoners.,,
The Romance of the Three Kingdoms is very famous.,,
The soldiers are performing a drill.,,
They are drilling.,,
I hope both sides will cooperate sincerely.,,
My brother will often sit up all night.,,
"In China, the party in power is the CPC.",,
The ruling party is not governing well.,,
A snake suddenly came in front of me and I was greatly startled.,,
Her diary is a record of her daily life.,,
Mankind has entered an era of science&technology.,,
I was sent to Hong Kong.,,
He was sent abroad to study.,,
I have chapped lips.,,
Father gestured to me to leave the room.,,
He's sitting in the waiting room.,,
"This subject is over my head, I can't do it.",,
"In his bank account, there is still a 500 Yuan surplus.",,
The company made a 1 million profit.,,
I looked him in the eyes.,,
Lao Yang's occupation is a teacher.,,
Fall has arrived.,,
I don't have a prejudice against foreign employees.,,
I can tie my shoelaces by myself.,,
The police confiscated his gun.,,
Can individuals own guns in America?,,
"In China, it is forbidden to buy or sell guns.",,
Guns are rampant.,,
Buds have appeared on the branch of the tree.,,
January 1st is called New Year's Day.,,
The accounting year begins from October 1st.,,
It's the early part of January right now.,,
The natural environment has suffered great destruction by mankind.,,
He is greedy.,,
He is very greedy. He wants to possess everything.,,
That nation is developing a new type of missile.,,
The power of missiles is very big.,,
He's been awarded a gold medal once.,,
Banks charge higher interest on loans to risky customers.,,
Mr. and Mrs. Smith live apart from each other now.,,
Guo Feng is old. His memory is in decline.,,
I think stealing is really immoral.,,
He is angry.,,
He was elected mayor of the city.,,
The water level of the river is about six meters.,,
Umbrellas can block the sunshine.,,
How could I be a robot? Robots can't dream. How could I be a robot? Robots don't dream.,,
A fire broke out in my neighborhood last night.,,
Fire! Run!,,
The castle looks stately.,,
How many watts is this electric bulb?,,
She is wearing a orange sweater.,,
Are you guys interested in foreign languages?,,
I know every inch of New York.,,
He holds the power in the company.,,
There are still some vacant seats here.,,
Luoyang is an ancient city in China.,,
Paparazzi are fond of taking pictures of the private lives of the stars.,,
Imagination affects every aspect of our lives.,,
There is a spare tire in the car.,,
The brilliance of diamonds is dazzling.,,
The sun shone with dazzling brightness.,,
This world is just an insane asylum. The world is a den of crazies.,,
He is very broadminded.,,
The eagle is the symbol of America.,,
The eagle is flying in the sky.,,
An eagle grabbed a chick.,,
The river water is very muddy.,,
The lunch has been eaten up.,,
When does the consulate open?,,
They live near the consulate.,,
She has short hair.,,
"My work schedule changed, so I adjusted my resting times.",,
The office has been separated into several small spaces.,,
The buildings shook in the earthquake.,,
